positive	AMBIENCE#GENERAL	atmosphere	31:41	There is something about their atmosphere that makes me come back nearly every week.
positive	RESTAURANT#GENERAL	place	34:39	I highly recommend this beautiful place.
positive	SERVICE#GENERAL	service	13:20	The food and service were fine, however the maitre-D was incredibly unwelcoming and arrogant.
positive	RESTAURANT#GENERAL	restaurant	74:84	If we were to move from the upper east side, we would genuinely miss this restaurant.
positive	FOOD#STYLE_OPTIONS	lobster sandwich	4:20	The lobster sandwich is $24 and although it was good it was not nearly enough to warrant that price.
positive	FOOD#QUALITY	food	4:8	The food is great and the environment is even better.
positive	AMBIENCE#GENERAL	ambiance	73:81	The owner and staff are all Japanese as well and that adds to the entire ambiance.
positive	SERVICE#GENERAL	wait staff	4:14	The wait staff is very freindly, they make it feel like you're eating in a freindly little european town.
negative	FOOD#QUALITY	pasta penne	4:15	The pasta penne was pretty extra buttery, creamy which means a big task to diggest.. tasty at first but i would say that i was full with a slice of pizza and 7 to count, penne...got a little moody afterwards cause was stuffed...lol
positive	FOOD#QUALITY	food	4:8	Our food was great too!
positive	FOOD#STYLE_OPTIONS	portions	4:12	The portions are large and the servers always surprise us with a different starter.
positive	DRINKS#QUALITY	wine	14:18	THe Pizza and wine were excellent-the service too--but what really MADE this place was the backyard dining area.
negative	RESTAURANT#GENERAL	Casa la Femme	27:40	Had an awful experience at Casa la Femme on a Saturday dinner.
positive	AMBIENCE#GENERAL	scene	9:14	Love the scene first off- the place has a character and nice light to it..very fortunate, location wise.
positive	SERVICE#GENERAL	Winnie	0:6	Winnie and her staff are the best crew you can find serving you.
positive	FOOD#QUALITY	appetizer menu	44:58	Try the Pad Thai, or sample anything on the appetizer menu...they're all delicious.
positive	SERVICE#GENERAL	service	21:28	Nice atmosphere, the service was very pleasant and the desert was good.
negative	RESTAURANT#GENERAL	place	17:22	Don’t go to this place!
positive	AMBIENCE#GENERAL	private booths	117:131	If you’re planning to come here, make sure that your date is someone whom you really like since you’ll be ushered to private booths where there will be no people or food watching (choose the ones on the ground level that have glass ceilings so you may see the stars in the sky!).
positive	FOOD#QUALITY	bagels	4:10	The bagels always warm, soft on the inside, crispy on the outside and enormous in size.
positive	FOOD#QUALITY	veal	4:8	The veal and the mushrooms were cooked perfectly.
positive	RESTAURANT#MISCELLANEOUS	restaurant	15:25	This is a nice restaurant if you are looking for a good place to host an intimate dinner meeting with business associates.
positive	FOOD#QUALITY	Salads	0:6	Salads are a delicious way to begin the meal.
negative	FOOD#STYLE_OPTIONS	portions	4:12	The portions are small but being that the food was so good makes up for that.
negative	FOOD#QUALITY	spice	98:103	The last two times I ordered from here my food was soo spicy that  I could barely eat it, and the spice took away from the flavor of the dish.
positive	FOOD#QUALITY	congee (rice porridge)	63:85	I also recommend the rice dishes or the different varieties of congee (rice porridge).
positive	FOOD#QUALITY	Ow Ley Soh	61:71	Try the congee and the donut like deep fried dough they call Ow Ley Soh, a delicious and sweet tasting bread.
positive	SERVICE#GENERAL	waiter	35:41	The service was spectacular as the waiter knew everything about the menu and his recommendations were amazing!
positive	FOOD#STYLE_OPTIONS	portions	17:25	And really large portions.
positive	FOOD#QUALITY	fresh mozzarella	34:50	The pizza is delicious - they use fresh mozzarella instead of the cheap, frozen, shredded cheese common to most pizzaria's.
positive	DRINKS#QUALITY	wine	108:112	I have known about this secret for the last 13 years, Emilio(the Godfather) has continued to serve food and wine for the gods at mortal prices.
positive	DRINKS#QUALITY	drinks	4:10	the drinks are amazing and half off till 8pm.
positive	FOOD#QUALITY	food	4:8	The food is great.
positive	AMBIENCE#GENERAL	ambience	31:39	This place has the the correct ambience and an excellent staff to make you feel like a guest and a friend at the same time.
positive	FOOD#QUALITY	Indian food	6:17	Great Indian food and the service is incredible.
negative	SERVICE#GENERAL	service	34:41	There is no excuse for such lousy service!
negative	FOOD#QUALITY	food	20:24	sometimes i get bad food and bad service, sometimes i get good good and bad service.
positive	FOOD#QUALITY	spicy tuna roll	4:19	The spicy tuna roll was unusually good and the rock shrimp tempura was awesome, great appetizer to share!
neutral	FOOD#QUALITY	Food	0:4	Food was just average...if they lowered the prices just a bit, it would be a bigger draw.
negative	SERVICE#GENERAL	service	63:70	They are extremely rude, not even apologizing for the horrible service we got and handing us a bill well over $500 for some drinks adn their pita bread!
positive	AMBIENCE#GENERAL	booths	12:18	Most of the booths allow you to sit next to eachother without looking like 'that' couple.
positive	FOOD#QUALITY	New England Chowder	21:40	My boyfriend had the New England Chowder it was good but I think the award should go to the Lobster Bisque.
positive	FOOD#QUALITY	Thin Crust Pizzas	129:146	I've also been amazed at all the new additions in the past few years: A new Jazz Bar, the most fantastic Dining Garden, the Best Thin Crust Pizzas, and now a Lasagna Menu which is to die for (these are not your average lasagnas)!
positive	AMBIENCE#GENERAL	place	46:51	The food was very good, a great deal, and the place its self was great.
negative	FOOD#STYLE_OPTIONS	dessert	37:44	I was looking for banana tempura for dessert and they dont have.
positive	AMBIENCE#GENERAL	jukebox	4:11	The jukebox plays everything from Italian Opera to The Strokes.
positive	FOOD#STYLE_OPTIONS	pizza	4:9	The pizza was pretty good and huge.
positive	FOOD#STYLE_OPTIONS	exotic food	4:15	The exotic food is beautifully presented and is a delight in delicious combinations.
negative	FOOD#STYLE_OPTIONS	pasta	4:9	The pasta was well cooked, didn't have enough sauce though or flavor.
positive	AMBIENCE#GENERAL	setting	4:11	The setting is casual and romantic.
positive	FOOD#QUALITY	Yakitori (bbq meats)	0:20	Yakitori (bbq meats) is tasty too.
positive	FOOD#QUALITY	hot dogs	4:12	The hot dogs are top notch, and they're Slamwich is amazing!
neutral	FOOD#QUALITY	Food	0:4	Food was good not great not worth the wait or another visit
negative	FOOD#STYLE_OPTIONS	chicken casserole	15:32	We ordered the chicken casserole, but what we got were a few small pieces of chicken, all dark meat and on the bone.
negative	AMBIENCE#GENERAL	interior	7:15	Mazing interior.
positive	FOOD#QUALITY	pad thai	9:17	The best pad thai i've ever had.
positive	AMBIENCE#GENERAL	actors	52:58	I loved everythig about it-especially the shows and actors.
positive	FOOD#QUALITY	margherita pizza	13:29	cirspy crust margherita pizza
positive	FOOD#QUALITY	crunchy tuna	8:20	Try the crunchy tuna, it is to die for.
positive	RESTAURANT#GENERAL	Jekyll and Hyde Pub	55:74	My husband and I thougt it would be great to go to the Jekyll and Hyde Pub for our anniversary, and to our surprise it was fantastic.
positive	RESTAURANT#GENERAL	The Four Seasons restaurant	0:27	The Four Seasons restaurant is a great experience.
positive	AMBIENCE#GENERAL	atmosphere	31:41	Rao's has the best service and atmosphere in NYC.
positive	FOOD#QUALITY	parmesean porcini souffle	17:42	Whether it's the parmesean porcini souffle or the lamb glazed with balsamic vinegar, you will surely be transported to Northern Italy with one bite.
positive	LOCATION#GENERAL	neighborhood	74:86	Not sure where the previous reviewer, lonk, dined, but Saul is in a great neighborhood and has great food!
negative	SERVICE#GENERAL	Service	0:7	Service is not what one would expect from a joint in this price category.
positive	AMBIENCE#GENERAL	glass ceilings	226:240	If you’re planning to come here, make sure that your date is someone whom you really like since you’ll be ushered to private booths where there will be no people or food watching (choose the ones on the ground level that have glass ceilings so you may see the stars in the sky!).
positive	FOOD#QUALITY	egg noodles in the beef broth with shrimp dumplings and slices of BBQ roast pork	24:104	I fell in love with the egg noodles in the beef broth with shrimp dumplings and slices of BBQ roast pork.
negative	FOOD#QUALITY	food	4:8	The food they serve is not comforting, not appetizing and uncooked.
negative	SERVICE#GENERAL	service	4:11	The service is awful.
negative	FOOD#QUALITY	food	4:8	The food is very average...the Thai fusion stuff is a bit too sweet, every thing they serve is too sweet here.
negative	SERVICE#GENERAL	staff	53:58	During the course of the past 3 months, the chef and staff changed and it was not for the better.
positive	AMBIENCE#GENERAL	fit-out	21:28	The place has a nice fit-out, some attractive furnishings and, from what I could tell, a reasonable wine list (I was given the food menu when I asked for the carte des vins)
positive	FOOD#QUALITY	$10 10-piece dim sum combo	10:36	I got the $10 10-piece dim sum combo, every bite of which was great.
positive	FOOD#QUALITY	Dog	6:9	Tasty Dog!
positive	SERVICE#GENERAL	Service	0:7	Service was also very good.
positive	DRINKS#QUALITY	iced tea	9:17	Have the iced tea.
positive	SERVICE#GENERAL	service	45:52	Not only is the cuisine the best around, the service has always been attentive and charming.
positive	RESTAURANT#GENERAL	Bukhara	0:7	Bukhara is on my top 5 Indian places in NYC
positive	RESTAURANT#GENERAL	place	29:34	You can't go wrong with this place.
positive	FOOD#QUALITY	crab salad	54:64	I did not try the caviar but I tried their salmon and crab salad (they are all good)  
positive	AMBIENCE#GENERAL	place	123:128	Although they do the typical what kind of water would you like questions the service was good and overall very relaxing to place to eat.
neutral	FOOD#QUALITY	Vanison	0:7	Vanison was good but not amazing.
positive	SERVICE#GENERAL	waiters	19:26	The only thing the waiters don't do for you is wipe your chin when you leave.
positive	SERVICE#GENERAL	staff	57:62	This place has the the correct ambience and an excellent staff to make you feel like a guest and a friend at the same time.
negative	FOOD#QUALITY	Dessert	0:7	Dessert is a joke...dont bother
positive	SERVICE#GENERAL	service	30:37	Have never had a problem with service save a missing rice once.
negative	FOOD#QUALITY	fish	41:45	If you don't mind pre-sliced low quality fish, unfriendly staff and a sushi chef that looks like he is miserable then this is your place.
positive	SERVICE#GENERAL	service	78:85	Whenever you need a Sushi fix, Mizu will be there with quality fish and great service.
negative	FOOD#QUALITY	roast pork buns	34:49	A few tips: skip the turnip cake, roast pork buns and egg custards.
negative	FOOD#QUALITY	chef	44:48	During the course of the past 3 months, the chef and staff changed and it was not for the better.
positive	FOOD#PRICES	food	27:31	$6 and there is much tasty food, all of it fresh and continually refilled.
positive	AMBIENCE#GENERAL	design	4:10	The design and atmosphere is just as good.
negative	SERVICE#GENERAL	service	8:15	but the service was a bit slow.
positive	FOOD#QUALITY	food	9:13	Fabulous food - if the front of house staff don't put you off – 
positive	RESTAURANT#GENERAL	place	12:17	This little place definitely exceeded my expectations and you sure get a lot of food for your money.
negative	SERVICE#GENERAL	delivery guys	31:44	Never have I had such dramatic delivery guys (a lot of huffing and panting and muttering under breath b/c I live in a walkup) who always seem disappointed with their tips.
positive	FOOD#STYLE_OPTIONS	BBE $29 fixe prix menu	17:39	My party had the BBE $29 fixe prix menu, which was such a wonderful deal since it also came with a flight of sake!
positive	DRINKS#QUALITY	strawberry daiquiries	10:31	Wonderful strawberry daiquiries as well!
negative	FOOD#QUALITY	pork shu mai	18:30	Chow fun was dry; pork shu mai was more than usually greasy and had to share a table with loud and rude family. 
negative	SERVICE#GENERAL	waitress	35:43	When we inquired about ports - the waitress listed off several but did not know taste variations or cost.
positive	FOOD#QUALITY	Shabu-Shabu	37:48	Thius is a must for anyone who loves Shabu-Shabu.
positive	FOOD#QUALITY	mussels	4:11	The mussels were fantastic and so was the dessert...definitely going to be back very soon.
positive	FOOD#PRICES	Prix Fixe menu	4:18	The Prix Fixe menu is worth every penny and you get more than enough (both in quantity AND quality).
positive	FOOD#QUALITY	food	4:8	The food is flavorful, plentiful and reasonably priced.
neutral	AMBIENCE#GENERAL	restaurant	4:14	The restaurant is a bit noisy but that is something that can be overlooked once you sit down and enjoy a great meal
neutral	LOCATION#GENERAL	place	4:9	The place is a bit hidden away, but once you get there, it's all worth it.
positive	SERVICE#GENERAL	service	80:87	The food was delicious (I had a halibut special, my husband had steak), and the service was top-notch.
negative	SERVICE#GENERAL	Service	0:7	Service was just ok, it is not what you'd expect for $500.
positive	FOOD#QUALITY	pizza	17:22	Pizza - the only pizza in NYC that should not have additional toppings - the crust tastes like the best, freshly baked bread!
positive	FOOD#QUALITY	food	8:12	Amazing food.
positive	DRINKS#QUALITY	beer	50:54	A cool bar with great food, and tons of excellent beer.
positive	FOOD#PRICES	food	4:8	The food was very good, a great deal, and the place its self was great.
positive	FOOD#PRICES	salad	62:67	The meat is fresh, the sauces are great, you get kimchi and a salad free with your meal and service is good too.
positive	FOOD#QUALITY	quacamole	0:9	quacamole at pacifico is yummy, as are the wings with chimmichuri.
positive	AMBIENCE#GENERAL	white organza tent	18:36	I book a gorgeous white organza tent which included a four course prix fix menu which we enjoyed a lot.
positive	AMBIENCE#GENERAL	atmosphere	5:15	Nice atmosphere, the service was very pleasant and the desert was good.
positive	LOCATION#GENERAL	restaurant	4:14	The restaurant looks out over beautiful green lawns to the Hudson River and the Statue of Liberty.
positive	DRINKS#QUALITY	drinks	4:10	The drinks are always welll made and wine selection is fairly priced.
positive	FOOD#STYLE_OPTIONS	fried shrimp	16:28	My wife had the fried shrimp which are huge and loved it.
negative	FOOD#PRICES	dinner for two	15:29	But $500 for a dinner for two that didn't include Wine?
positive	FOOD#QUALITY	grilled octopus	77:92	I'll being with a couple of positives: cool decor, good pita and hummus, and grilled octopus that was actually pretty tasty.
negative	RESTAURANT#GENERAL	Teodora	143:150	To be completely fair, the only redeeming factor was the food, which was above average, but couldn't make up for all the other deficiencies of Teodora.
negative	SERVICE#GENERAL	server	12:18	A different server enhanced the fun, dumping our entrees in front of us halfway through our appetizer (which was delicious).
negative	FOOD#QUALITY	grilled branzino	24:40	We ordered the special, grilled branzino, that was so infused with bone, it was difficult to eat.
neutral	FOOD#STYLE_OPTIONS	Indian food	13:24	Very "normal Indian food", but done really well.
positive	FOOD#QUALITY	sea urchin	42:52	I tend to judge a sushi restaurant by its sea urchin, which was heavenly at sushi rose.
positive	RESTAURANT#MISCELLANEOUS	Water's Edge	35:47	My daughter's wedding reception at Water's Edge received the highest compliments from our guests.
negative	FOOD#QUALITY	food	4:8	The food here was mediocre at best. 
positive	AMBIENCE#GENERAL	looks	13:18	Over all the looks of the place exceeds the actual meals.
positive	FOOD#QUALITY	pizza	6:11	Great pizza and fantastic service.
positive	FOOD#QUALITY	food	68:72	Just because it's cheap does NOT mean the portions are small or the food is nasty, IT IS GREAT!
negative	FOOD#QUALITY	dessert	32:39	The entree was bland and small, dessert was not inspired.
negative	FOOD#QUALITY	food	25:29	If you are going for the food, it will not be worth it.
positive	SERVICE#GENERAL	service	26:33	Great pizza and fantastic service.
negative	RESTAURANT#PRICES	place	166:171	I have it a 4 instead of 5 because of the price (just chicken tikka masala - no bread of rice - is $25), which I would expect at a upscale Indian restaurant but this place doesn't have an upscale feel.
negative	FOOD#QUALITY	food	6:10	Gross food – Wow-
positive	FOOD#QUALITY	food	4:8	The food was average to above-average; the French Onion soup filling yet not overly impressive, and the desserts not brilliant in any way.
negative	FOOD#QUALITY	raddichio	76:85	Mine was a little burnt but still delicious with goat cheese and panchetta (raddichio was kind of bitter though).
positive	FOOD#QUALITY	food	21:25	sometimes i get good food and ok service.
negative	AMBIENCE#GENERAL	tables	4:10	The tables are crammed way too close, the menu is typical of any Italian restaurant, and the wine list is simply overpriced.
negative	RESTAURANT#PRICES	The Four Seasons	21:37	Not because you are "The Four Seasons"... – you are allowed to charge an arm and a leg for a romatic dinner.
positive	DRINKS#QUALITY	premium sake	43:55	The blond wood decor is very soothing, the premium sake is excellent and the service is great.
positive	FOOD#QUALITY	Margheritta slice	28:45	Awsome Pizza especially the Margheritta slice.
positive	RESTAURANT#GENERAL	place	85:90	amazing fun for hot dog lovers of all ages PLEASE do yourself a favor and check this place out!!!!
positive	FOOD#QUALITY	sushi	19:24	The first time the sushi was outstanding, the second time it was a little bland.
positive	FOOD#STYLE_OPTIONS	paninis	36:43	The large selection of bruschettas, paninis, tramezzinis keep the palate from stagnating.
positive	RESTAURANT#GENERAL	place	38:43	I've lived in NY for 5 years and this place has it all.
negative	FOOD#QUALITY	chef	98:102	Wasn't going to share but I feel obligated...while sitting at the sushi bar dining we watched the chef accidentally drop a piece of Unagi on the floor and upon retrieving it from the floor proceed to use the piece in the delivery order he was preparing.
positive	FOOD#QUALITY	food	4:8	The food was delicious but do not come here on a empty stomach.
neutral	RESTAURANT#PRICES	location	59:67	Not what I would expect for the price and prestige of this location.
negative	SERVICE#GENERAL	staff	74:79	I wish I could like this place more, and I wish someone would retrain the staff.
positive	FOOD#QUALITY	food	47:51	Have frequented 'ino for several years and the food remains excellent.
positive	FOOD#QUALITY	Thai style Fried Sea Bass	10:35	I had the Thai style Fried Sea Bass...which was very good. 
positive	FOOD#QUALITY	fried shrimp	16:28	My wife had the fried shrimp which are huge and loved it.
positive	FOOD#PRICES	prixe fixe tasting menu	32:55	The food can get pricey but the prixe fixe tasting menu is the greatest food for a good price and they cater the food to any food allergies or food you don't like.
positive	FOOD#QUALITY	Guacamole+shrimp appetizer	0:26	Guacamole+shrimp appetizer was really great, we both had the filet, very good, didn't much like the frites that came with, but the filet was so good, neither of us cared.
neutral	FOOD#QUALITY	dim sum	82:89	My friends settled for rice dishes, but we came back the following day to try the dim sum, which was good...not outstanding, but good.
positive	FOOD#QUALITY	sausages	139:147	What really makes it shine is the food, which is aggressively seasoned with Cyrpriot spices, and all made in-house (even the gyro meat and sausages), and made of much higher quality ingredients that might otherwise be expected.
positive	SERVICE#GENERAL	waitstaff	82:91	Considering we were the last patrons there and it was after the closing time, the waitstaff did not rush us at all and made us feel comfortable and relaxed.
negative	RESTAURANT#GENERAL	place	29:34	I would never recommend this place to anybody even for a casual dinner.
positive	FOOD#QUALITY	drunken chicken	28:43	I recommend the jelly fish, drunken chicken and the soupy dumplings, certainly the stir fry blue crab.
neutral	FOOD#QUALITY	scallion pancakes	4:21	The scallion pancakes and fried dumplings were nothing out of the ordinary.
neutral	FOOD#STYLE_OPTIONS	cheeseburgers	38:51	My son and his girlfriend both wanted cheeseburgers and they were huge!
positive	RESTAURANT#GENERAL	brasserie	191:200	Maybe it was the great company (I had friends visiting from Philly – yes, it was not a date this time) or the super reasonable price point, but I just can’t say enough good things about this brasserie.
positive	RESTAURANT#GENERAL	place	6:11	Great place, great value.
neutral	FOOD#STYLE_OPTIONS	menu	42:46	The tables are crammed way too close, the menu is typical of any Italian restaurant, and the wine list is simply overpriced.
positive	AMBIENCE#GENERAL	atmosphere	25:35	Everyone raved about the atmosphere (elegant rooms and absolutely incomparable views) and the fabulous food!
positive	FOOD#STYLE_OPTIONS	French Onion soup	43:60	The food was average to above-average; the French Onion soup filling yet not overly impressive, and the desserts not brilliant in any way.
positive	FOOD#QUALITY	sushi	6:11	Great sushi experience.
positive	RESTAURANT#GENERAL	Restaurant Saul	50:65	Every time in New York I make it a point to visit Restaurant Saul on Smith Street.
positive	SERVICE#GENERAL	Manager	29:36	We even had a visit from the Manager who wanted to make sure we were enjoying ourselves.
negative	FOOD#STYLE_OPTIONS	menu	4:8	The menu is limited but almost all of the dishes are excellent.
negative	FOOD#QUALITY	meals	43:48	Everything was going good until we got our meals.
neutral	SERVICE#GENERAL	Service	0:7	Service is not exactly five star, but thats not really a big deal.
positive	FOOD#QUALITY	fried oysters and clams	60:83	The appetizers we ordered were served quickly - an order of fried oysters and clams were delicious but a tiny portion (maybe 3 of each). 
positive	RESTAURANT#GENERAL	YUKA	5:9	Love YUKA.
positive	RESTAURANT#GENERAL	place	166:171	I have it a 4 instead of 5 because of the price (just chicken tikka masala - no bread of rice - is $25), which I would expect at a upscale Indian restaurant but this place doesn't have an upscale feel.
neutral	FOOD#QUALITY	bibimbap	4:12	The bibimbap was average, but the stone bowl wasn't even close to sizzling.
negative	FOOD#STYLE_OPTIONS	dosas	4:9	The dosas are skimpy, unattractive and drip with grease, and personally I'd drink popcorn topping before I'd eat another one of these.
positive	RESTAURANT#GENERAL	pizzeria	27:35	I stumbled upon this great pizzeria as I explored my new neighborhood.
positive	RESTAURANT#GENERAL	Pizza 33	5:13	Love Pizza 33..
positive	FOOD#STYLE_OPTIONS	bagels	4:10	The bagels always warm, soft on the inside, crispy on the outside and enormous in size.
negative	FOOD#QUALITY	sushi	47:52	Furthermore, the rice had no seasoning, so the sushi was bland and disgusting.
positive	AMBIENCE#GENERAL	setting	75:82	I'd highly recommend it for a special occasion -- it provides and intimate setting and nice service.
positive	DRINKS#STYLE_OPTIONS	wine list	4:13	The wine list is interesting and has many good values.
positive	AMBIENCE#GENERAL	decor	4:9	The decor is very simple but comfortable.
positive	RESTAURANT#GENERAL	spot	23:27	But nonetheless--great spot, great food.
negative	FOOD#QUALITY	sauces	28:34	The food was not fresh, the sauces were bland and very oily.
negative	FOOD#QUALITY	salmon	29:35	I took one bite from the $24 salmon, and I have never, in the 17 years I have been going to restaurants tasted salmon as fishy, as dry, and as bland as the one in Flatbush Farms.
neutral	AMBIENCE#GENERAL	restaurant	44:54	So what you really end up paying for is the restaurant not the food.
positive	RESTAURANT#GENERAL	spot	24:28	It is definitely a good spot for snacks and chat.
positive	AMBIENCE#GENERAL	backyard dining area	91:111	THe Pizza and wine were excellent-the service too--but what really MADE this place was the backyard dining area.
positive	FOOD#QUALITY	Dancing, White River and Millenium rolls	4:44	The Dancing, White River and Millenium rolls are musts.
positive	FOOD#QUALITY	Pizza	4:9	THe Pizza and wine were excellent-the service too--but what really MADE this place was the backyard dining area.
positive	FOOD#QUALITY	food	43:47	Everyone seemed generally happy with their food, except my brother who had the grilled Mahi Mahi, seemingly drenched in Grapfruit Juice! 
positive	DRINKS#STYLE_OPTIONS	selecion of wines	39:56	The food is great and they have a good selecion of wines at reasonable prices.
positive	FOOD#QUALITY	BBQ ribs	38:46	This place has the best Chinese style BBQ ribs in the city.
negative	FOOD#QUALITY	rice	17:21	Furthermore, the rice had no seasoning, so the sushi was bland and disgusting.
positive	SERVICE#GENERAL	service	32:39	The food is outstanding and the service is quick, friendly and very professional.
positive	FOOD#QUALITY	spices	9:15	Delicate spices, onions, eggs and a kick-ass roti.
negative	SERVICE#GENERAL	service	21:28	Decor is nice though service can be spotty.
positive	FOOD#QUALITY	food	5:9	Good food: my favorite is the seafood spaghetti.
positive	AMBIENCE#GENERAL	decor	30:35	The service is excellent, the decor is great, and the food is delicious and comes in large portions.
