positive	FOOD#QUALITY	ingredients	6:17	Fresh ingredients and everything is made to order.
positive	FOOD#PRICES	pizzas	11:17	All of the pizzas are terrific and the price is even better!
positive	FOOD#QUALITY	sushi	75:80	Planet Thailand has always been a hit with me , I go there usually for the sushi, which is great , the thai food is excellent too .
negative	FOOD#PRICES	japanese food	11:24	overpriced japanese food with mediocre service
positive	FOOD#QUALITY	four course prix fix menu	54:79	I book a gorgeous white organza tent which included a four course prix fix menu which we enjoyed a lot.
neutral	DRINKS#QUALITY	wine	7:11	Decent wine at reasonable prices.
positive	FOOD#QUALITY	food	4:8	The food is great and reasonably priced.
positive	FOOD#QUALITY	Korean food	61:72	Dokebi gives Williamsburg the right one-two punch of classic Korean food and fusion twists like pork belly tacos.
positive	RESTAURANT#GENERAL	Cafe Noir	52:61	The whole set up is truly unprofessional and I wish Cafe Noir would get some good staff, because despite the current one this is a great place.
positive	FOOD#QUALITY	kababs	54:60	and yes Dal Bukhara is so dam good and so are all the kababs.
positive	FOOD#QUALITY	food	21:25	Service was good and food is wonderful.
negative	FOOD#PRICES	Food	0:4	Food was just average...if they lowered the prices just a bit, it would be a bigger draw.
positive	FOOD#STYLE_OPTIONS	portion	52:59	My husband said he could've eaten several more, the portion was fine for me he even exclaimed that the french fries were the best he has had.
positive	RESTAURANT#MISCELLANEOUS	1st Ave spot	19:31	Worth visiting the 1st Ave spot because it is the original store.
positive	SERVICE#GENERAL	service	8:15	Helpful service and average price per dish $10.
neutral	FOOD#QUALITY	Bagels	0:6	Bagels are ok, but be sure not to make any special requests!
positive	FOOD#QUALITY	regular menu-fare	49:66	The food is delicious - from the specials to the regular menu-fare, the dishes are never a disappointment.
positive	FOOD#QUALITY	hot dog	16:23	amazing fun for hot dog lovers of all ages PLEASE do yourself a favor and check this place out!!!!
negative	FOOD#QUALITY	food	42:46	I'm still mad that i had to pay for lousy food.
negative	FOOD#QUALITY	food	25:29	Sauce was watery and the food didn't have much flavor.
positive	RESTAURANT#GENERAL	restaurant	79:89	The svc can be a bit rude at times, esp if you have big group, but overall the restaurant is a must!
positive	SERVICE#GENERAL	service	29:36	The place is so cool and the service is prompt and curtious.
positive	FOOD#QUALITY	fish dishes	188:199	Each time we've been, the front of house staff (not the waiters - they're fantastic - but the people who greet and seat you) has been so hideous to us that were it not for the exceptional fish dishes I would never return. 
negative	SERVICE#GENERAL	staff	75:80	We, there were four of us, arrived at noon - the place was empty - and the staff acted like we were imposing on them and they were very rude.
positive	DRINKS#STYLE_OPTIONS	sake menu	4:13	The sake menu should not be overlooked!
negative	FOOD#QUALITY	food	31:35	Also, specify if you like your food spicy- its rather bland if you don't.
neutral	FOOD#STYLE_OPTIONS	pastrami sandwich on a roll	13:40	I had a huge pastrami sandwich on a roll.
positive	RESTAURANT#GENERAL	Suan	17:21	I recently tried Suan and I thought that it was great.
positive	FOOD#QUALITY	Sushi	9:14	Favorite Sushi in NYC
positive	FOOD#QUALITY	food	30:34	The waiter was attentive, the food was delicious and the views of the city were great.
positive	AMBIENCE#GENERAL	bar scene	34:43	The place itself is beautiful the bar scene seems to be happening.
negative	AMBIENCE#GENERAL	place	19:24	First of all, this place is *not* romantic, as claimed by Citysearch's editorial review.
positive	RESTAURANT#GENERAL	place	39:44	Please take my advice, go and try this place.
positive	FOOD#QUALITY	Spreads	0:7	Spreads and toppings are great - though a bit pricey.
negative	FOOD#QUALITY	kimchee	187:194	However, once I received my predictably mediocre order of what Dokebi thinks passes as Korean fair, (sometimes you have to settle when it's your only option), I got through about half my kimchee before I found a piece of random lettuce accompanied by a far more disgusting, slimy, clearly bad piece of fish skin.
positive	AMBIENCE#GENERAL	scene	26:31	It is quite a spectacular scene i'll give them that.
positive	RESTAURANT#GENERAL	Fish	35:39	Went on a 3 day oyster binge, with Fish bringing up the closing, and I am so glad this was the place it O trip ended, because it was so great!
positive	LOCATION#GENERAL	location	90:98	Love the scene first off- the place has a character and nice light to it..very fortunate, location wise.
negative	RESTAURANT#GENERAL	place	5:10	Cute place, nice wait staff but would never go there again.
negative	FOOD#PRICES	food	4:8	The food can get pricey but the prixe fixe tasting menu is the greatest food for a good price and they cater the food to any food allergies or food you don't like.
negative	AMBIENCE#GENERAL	decor	39:44	The only thing that strikes you is the decor?(not very pleasant).
negative	FOOD#QUALITY	Go Go Hamburgers	15:31	Do not get the Go Go Hamburgers, no matter what the reviews say.
positive	RESTAURANT#GENERAL	Corona	103:109	If you venture off the island of Manhattan and can't seem to find a great Italian restaurant, drive to Corona.
positive	RESTAURANT#GENERAL	mare	19:23	We all agreed that mare is one of the best seafood restaurants in New York.
positive	RESTAURANT#GENERAL	restaurant	61:71	Our family never expected such incredible entertainment in a restaurant.
positive	FOOD#QUALITY	sushi	29:34	We are very particular about sushi and were both please with every choice which included: ceviche mix (special), crab dumplings, assorted sashimi, sushi and rolls, two types of sake, and the banana tempura.
positive	FOOD#QUALITY	Indian	20:26	They have authentic Indian at amazin prices.
positive	AMBIENCE#GENERAL	place	22:27	However, I think this place is a good hang out spot.
negative	FOOD#QUALITY	dish	42:46	My wife had barely touched that mess of a dish.
positive	SERVICE#GENERAL	waiters	32:39	The atmosphere is noisy and the waiters are literally walking around doing things as fast as they can.
positive	DRINKS#STYLE_OPTIONS	wine list	4:13	The wine list is extensive and impressive.
positive	FOOD#QUALITY	dish	5:9	This dish is my favorite and I always get it when I go there and never get tired of it.
negative	SERVICE#GENERAL	waiters	6:13	Also, waiters try to push more food on you, like suggest things as if they are complimentary when they actually cost $.
positive	FOOD#STYLE_OPTIONS	hot dog	9:16	Here the hot dog is elevated to the level of a real entree with numerous variations available.
negative	RESTAURANT#GENERAL	palce	12:17	How is this palce still open?
positive	FOOD#QUALITY	Food	0:4	Food is great and inexpensive.
positive	RESTAURANT#PRICES	Suan	126:130	Its location is good and the fact that Hutner College is near and their prices are very reasonable, makes students go back to Suan again and again.
positive	FOOD#QUALITY	japanese comfort food	48:69	it's the only place you can get yummy authentic japanese comfort food.
negative	FOOD#PRICES	sandwiches	10:20	Also, the sandwiches (nearing $7) didn't come with anything like chips or a side.
positive	SERVICE#GENERAL	servers	12:19	Most of the servers are very attentive, friendly and quite attractive.
negative	FOOD#STYLE_OPTIONS	dishes	49:55	This restaurant is VEGETARIAN; there are NO MEAT dishes whatsoever.
positive	FOOD#QUALITY	pizza	6:11	Great pizza for lunch place.
positive	FOOD#QUALITY	food	82:86	Though it's been crowded most times I've gone here, Bark always delivers on their food.
positive	SERVICE#GENERAL	service	80:87	Although the tables may be closely situated, the candle-light, food-quality and service overcompensate.
negative	FOOD#QUALITY	bread	4:9	The bread was stale, the salad was overpriced and empty.
positive	FOOD#STYLE_OPTIONS	food	4:8	The food is flavorful, plentiful and reasonably priced.
negative	FOOD#STYLE_OPTIONS	menu	27:31	Despite a slightly limited menu, everything prepared is done to perfection, ultra fresh and a work of food art.
neutral	FOOD#STYLE_OPTIONS	menu	4:8	The menu is fairly simple without much descriptions. 
positive	FOOD#STYLE_OPTIONS	portions	91:99	The service is excellent, the decor is great, and the food is delicious and comes in large portions.
negative	FOOD#PRICES	lunch buffet	4:16	The lunch buffet is expensive but is deff worth it.
positive	FOOD#QUALITY	dishes	62:68	The food was average or above including some surprising tasty dishes.
positive	FOOD#QUALITY	food	48:52	Go to Volare for 1st class service and terrific food.
positive	AMBIENCE#GENERAL	Dining Garden	105:118	I've also been amazed at all the new additions in the past few years: A new Jazz Bar, the most fantastic Dining Garden, the Best Thin Crust Pizzas, and now a Lasagna Menu which is to die for (these are not your average lasagnas)!
positive	FOOD#STYLE_OPTIONS	Steak Tartare	4:17	The Steak Tartare is a great bet, they fix it for you at the table.
positive	FOOD#QUALITY	BBQ Salmon	30:40	Luckily we saved room for the BBQ Salmon, Sea Bass and Crispy Duck.
neutral	FOOD#QUALITY	food	66:70	The menu looked great, and the waiter was very nice, but when the food came, it was average.
positive	FOOD#QUALITY	risotto	17:24	The wife had the risotto which was amazing.
positive	FOOD#QUALITY	baked clams octopus	4:23	The baked clams octopus we shared as appetizers were the best we've ever had!! 
positive	FOOD#QUALITY	lamb sausages	62:75	The dishes offered were unique, very tasty and fresh from the lamb sausages, sardines with biscuits, large whole shrimp to the amazing pistachio ice cream (the best and freshest I've ever had).
positive	RESTAURANT#GENERAL	Saul	0:4	Saul is the best restaurant on Smith Street and in Brooklyn.
positive	AMBIENCE#GENERAL	atmosphere	123:133	Leon is an East Village gem: casual but hip, with well prepared basic French bistro fare, good specials, a warm and lively atmosphere.
positive	SERVICE#GENERAL	Delivery	43:51	Great friendly service, Fast seating, Fast Delivery, Excellent sushi.
positive	RESTAURANT#GENERAL	Big Wong	0:8	Big Wong is a great place to eat and fill your stomach.
positive	FOOD#QUALITY	Grilled Chicken special with Edamame Puree	46:88	The only thing I moderately enjoyed was their Grilled Chicken special with Edamame Puree.
positive	FOOD#QUALITY	dishes	42:48	I am not a vegetarian but, almost all the dishes were great.
positive	FOOD#QUALITY	rolls	16:21	They have great rolls, the triple color and norwegetan rolls, are awesome and filling.
negative	FOOD#QUALITY	Chilli Chicken	145:159	The chicken lollipop is my favorite, most of the dishes (I have to agree with a previous reviewer) are quite oily and very spicy, espeically the Chilli Chicken.
positive	DRINKS#STYLE_OPTIONS	wine	53:57	The place is a BISTRO which means: simple dishes and wine served efficiently in a bustling atmosphere.
positive	RESTAURANT#GENERAL	restaurant	19:29	Overall, excellent restaurant!
negative	AMBIENCE#GENERAL	ambiance	5:13	Zero ambiance to boot.
positive	FOOD#PRICES	Cheese plate	0:12	Cheese plate is a varied delight and great bargain at $10.
negative	RESTAURANT#GENERAL	The Four Seasons	59:75	The food was excellent as well as service, however, I left The Four Seasons very dissappointed.
negative	FOOD#QUALITY	sushi	19:24	The first time the sushi was outstanding, the second time it was a little bland.
positive	FOOD#QUALITY	sea bass	8:16	Try the sea bass.
negative	SERVICE#GENERAL	service	46:53	For the people who want great food plus great service, Roxy is a place to AVOID!
positive	DRINKS#QUALITY	wine	67:71	We have been to this place many times, and always have great food, wine, and service.
positive	FOOD#QUALITY	drumsticks over rice	5:25	Best drumsticks over rice and sour spicy soup in town!
positive	FOOD#QUALITY	Food	0:4	Food was amazing - I love Indian food and eat it quite regularly, but I can say this is one of the best I've had.
positive	FOOD#QUALITY	salads	66:72	Although we were looking for regular lettuce and some walnuts the salads we got were great.
positive	FOOD#QUALITY	Taiwanese food	5:19	Best Taiwanese food in NY!
positive	SERVICE#GENERAL	service	84:91	I have been coming here for years and have nothing but good things to say about the service and the great staff at La Lanterna.
positive	FOOD#QUALITY	Sushi	6:11	Best. Sushi. Ever.
positive	SERVICE#GENERAL	service	13:20	An excellent service
positive	FOOD#QUALITY	mushroom pizza	18:32	My friend got the mushroom pizza which tasted better.
positive	AMBIENCE#GENERAL	Leon	0:4	Leon is an East Village gem: casual but hip, with well prepared basic French bistro fare, good specials, a warm and lively atmosphere.
positive	FOOD#QUALITY	margherita pizza	7:23	i love margherita pizza – i looove east village pizza
negative	AMBIENCE#GENERAL	atmosphere	4:14	The atmosphere is noisy and the waiters are literally walking around doing things as fast as they can.
positive	AMBIENCE#GENERAL	belly dancers	19:32	Watch the talented belly dancers as you enjoy delicious baba ganoush that's more lemony than smoky.
negative	SERVICE#GENERAL	service	48:55	Both times I was extremely dissappointed by the service, which was boarderline rude.
positive	FOOD#QUALITY	Sushi	0:5	Sushi experience was unbelievable with my fiance.
positive	FOOD#QUALITY	fish and chips	55:69	Other guests enjoyed pizza, santa fe chopped salad and fish and chips.
positive	SERVICE#GENERAL	service	78:85	I highly recommend Cafe St. Bart's for their food, the ambience and wonderful service.
negative	FOOD#QUALITY	Dessert	0:7	Dessert: pure disaster.
positive	FOOD#QUALITY	Mussles	0:7	Mussles and calamari were superb Saturday evening.
positive	SERVICE#GENERAL	service	0:7	service is friendly, and never had a problem walking in and getting a table.
positive	FOOD#QUALITY	Red Dragon Roll	32:47	Just go to Yamato and order the Red Dragon Roll.
positive	SERVICE#GENERAL	Seating	0:7	Seating is always prompt, though the restaurant does fill up in the evening.
neutral	AMBIENCE#GENERAL	decor	4:9	The decor in this place is very diner-ish and the kind of place you expect in the East Village - not romantic, just simple, small and sparse.
positive	FOOD#STYLE_OPTIONS	Personal pans	0:13	Personal pans are the perfect size for those hungry nights.
positive	FOOD#QUALITY	caviar	72:78	I highly recommend Caviar Russe to anyone who wants delicious top grade caviar and fantastic service.
negative	SERVICE#GENERAL	Service	0:7	Service was very prompt but slightly rushed.
negative	SERVICE#GENERAL	customer service	92:108	This place would be so much better served by being run by a group that actually understands customer service.
positive	FOOD#QUALITY	sepia	58:63	The pastas are incredible, the risottos (particularly the sepia) are fantastic and the braised rabbit is amazing.
positive	FOOD#QUALITY	meal	50:54	With the theater 2 blocks away we had a delicious meal in a beautiful room.
positive	FOOD#STYLE_OPTIONS	half/half pizza	7:22	We had half/half pizza, mine was eggplant and my friend had the buffalo and it was sooo huge for a small size pizza!
positive	AMBIENCE#GENERAL	mileau	47:53	Everything was wonderful; food, drinks, staff, mileau.
positive	AMBIENCE#GENERAL	environment	26:37	The food is great and the environment is even better.
positive	FOOD#QUALITY	sashimi amuse bouche	33:53	We started off with a delightful sashimi amuse bouche.
positive	FOOD#QUALITY	sushi	4:9	The sushi is amazing!!! 
negative	SERVICE#GENERAL	service	5:12	Poor service and management
positive	FOOD#QUALITY	modern Japanese food	63:83	Despite the confusing mirrors this will likely be my go-to for modern Japanese food for the foreseeable future.
positive	RESTAURANT#GENERAL	trattoria	25:34	This quaint and romantic trattoria is at the top of my Manhattan restaurant list.
negative	FOOD#QUALITY	chicken in the salads	18:39	A weakness is the chicken in the salads.
positive	AMBIENCE#GENERAL	decor	44:49	I'll being with a couple of positives: cool decor, good pita and hummus, and grilled octopus that was actually pretty tasty.
positive	FOOD#QUALITY	food	64:68	A restaurant that doesn't try to do anything except serve great food with great service in a pleasant atmosphere.
positive	FOOD#QUALITY	chef's specials	10:25	Try their chef's specials-- they are to die for.
positive	SERVICE#GENERAL	Delivery	0:8	Delivery is fast too.
positive	FOOD#QUALITY	wasabe potatoes	13:28	The tuna and wasabe potatoes are excellent.
positive	FOOD#QUALITY	veal	4:8	The veal was incredible last night.
positive	FOOD#STYLE_OPTIONS	food	80:84	This little place definitely exceeded my expectations and you sure get a lot of food for your money.
positive	FOOD#QUALITY	food	32:36	The staff was accomodating, the food was absolutely delicious and the place is lovely.
negative	SERVICE#GENERAL	waitress	40:48	We were planning to get dessert but the waitress basically through the bill at us before we had a chance to order.
positive	SERVICE#GENERAL	service	35:42	When we sat, we got great and fast service.
negative	FOOD#PRICES	dinner	34:40	I would not expect this for a $55 dinner.
positive	FOOD#QUALITY	food	35:39	But nonetheless--great spot, great food.
neutral	FOOD#STYLE_OPTIONS	lobster knuckles	4:20	The lobster knuckles (special of the day) were ok, but pretty tasteless.
negative	SERVICE#GENERAL	clerks	147:153	Calling the place Hampton Chutney Co. does warn you that these folks offer more style than substance, but in this unattractive room with unhelpful clerks there was a dearth of the former too.
negative	FOOD#PRICES	pizza	4:9	The pizza is overpriced and soggy.
positive	FOOD#QUALITY	chicken lollipop	4:20	The chicken lollipop is my favorite, most of the dishes (I have to agree with a previous reviewer) are quite oily and very spicy, espeically the Chilli Chicken.
positive	FOOD#PRICES	food	4:8	The food is great and reasonably priced.
positive	RESTAURANT#GENERAL	pizza place	15:26	This is a nice pizza place with good selection of thin crust pizza including the Basil slice.
positive	RESTAURANT#GENERAL	place	23:28	Make sure you try this place as often as you can.
positive	FOOD#QUALITY	bun	137:140	The hot dogs are good, yes, but the reason to get over here is the fantastic pork croquette sandwich, perfect on its supermarket squishy bun.
neutral	FOOD#QUALITY	food	47:51	However, go for the ambience, and consider the food just a companion for a trip across the world!
positive	FOOD#QUALITY	pizzas	11:17	All of the pizzas are terrific and the price is even better!
negative	AMBIENCE#GENERAL	resturant	49:58	Prices too high for this cramped and unappealing resturant.
positive	SERVICE#GENERAL	Service	0:7	Service is fast and friendly.
positive	FOOD#QUALITY	ingredients	20:31	Yes, they use fancy ingredients, but even fancy ingredients don't make for good pizza unless someone knows how to get the crust right.
positive	SERVICE#GENERAL	service	77:84	This is my first time writing a review for a restaurant because the food and service was excellent.
negative	RESTAURANT#GENERAL	restaurant	47:57	The service was the only thing good about this restaurant.
positive	AMBIENCE#GENERAL	place	12:17	It's a nice place to relax and have conversation.
positive	FOOD#QUALITY	crab dumplings	113:127	We are very particular about sushi and were both please with every choice which included: ceviche mix (special), crab dumplings, assorted sashimi, sushi and rolls, two types of sake, and the banana tempura.
positive	RESTAURANT#GENERAL	restaurant	23:33	I highly recommend the restaurant based on our experience last night.
positive	FOOD#QUALITY	sardines with biscuits	77:99	The dishes offered were unique, very tasty and fresh from the lamb sausages, sardines with biscuits, large whole shrimp to the amazing pistachio ice cream (the best and freshest I've ever had).
neutral	SERVICE#GENERAL	Service	0:7	Service is average.
positive	FOOD#QUALITY	food	46:50	The waitress was very patient with us and the food is phenomenal!
negative	FOOD#QUALITY	sushi	35:40	It's boring on the inside, and our sushi was pretty below average... the tuna was soggy and the other rolls had no flavor.
positive	AMBIENCE#GENERAL	atmosphere	50:60	I almost hesititate to write a review because the atmosphere was so great and I would hate for it too become to crowded.
negative	SERVICE#GENERAL	service	37:44	The price is reasonable although the service is poor.
negative	RESTAURANT#GENERAL	place	11:16	Avoid this place!
negative	FOOD#QUALITY	cheese	37:43	The pizza was delivered cold and the cheese wasn't even fully melted!
negative	SERVICE#GENERAL	service	65:72	Very immature bartender, didnt know how to make specific drinks, service was so slowwwww, the food was not fresh or warm, waitresses were busy flirting with men at the bar and werent very attentive to all the customers.
positive	FOOD#QUALITY	chicken	15:22	stick with the chicken, beef, and lamb dishes.
negative	FOOD#PRICES	eggplant	110:118	The decor however seems to be the distraction so you won't notice that you just payed 300 bucks for some cold eggplant that took 2 FRICKIN HOURS TO COME!!!!
positive	AMBIENCE#GENERAL	furnishings	46:57	The place has a nice fit-out, some attractive furnishings and, from what I could tell, a reasonable wine list (I was given the food menu when I asked for the carte des vins)
positive	FOOD#QUALITY	food	4:8	The food is yummy, especially their cooked-to-perfection mussels in spicy tomato sauce and their shoestring crispy fries.
negative	SERVICE#GENERAL	maitre-D	44:52	The food and service were fine, however the maitre-D was incredibly unwelcoming and arrogant.
positive	RESTAURANT#GENERAL	place	13:18	What a great place!
negative	FOOD#QUALITY	portobello and asparagus mole	39:68	Also, I personally wasn't a fan of the portobello and asparagus mole.
neutral	FOOD#QUALITY	food	4:8	the food is decent.
positive	FOOD#QUALITY	hot dogs	4:12	The hot dogs are good, yes, but the reason to get over here is the fantastic pork croquette sandwich, perfect on its supermarket squishy bun.
positive	FOOD#QUALITY	lobster sandwich	4:20	The lobster sandwich is good and the spaghetti with Scallops and Shrimp is great.
positive	SERVICE#GENERAL	manager	19:26	I showed it to the manager, and he smilingly apologized and brought us two free desserts (but did not ask us what we wanted and so brought the last two desserts we would have asked for).
negative	FOOD#QUALITY	food	39:43	I have never been so disgusted by both food an service.
positive	DRINKS#PRICES	bev	51:54	Prices are fair across the board for both food and bev.
positive	FOOD#QUALITY	food	39:43	The place is small and cramped but the food is fantastic.
negative	FOOD#QUALITY	lobster ravioli	23:38	Moules were excellent, lobster ravioli was VERY salty!
positive	AMBIENCE#GENERAL	room	70:74	With the theater 2 blocks away we had a delicious meal in a beautiful room.
positive	RESTAURANT#GENERAL	place	5:10	This place blew me away...by far my new favorite restaurant on the uppereast side.
negative	RESTAURANT#GENERAL	restaurant	5:15	This restaurant was way overhyped.
positive	FOOD#QUALITY	mahi mahi (on saffron risotto	40:69	I really like both the scallops and the mahi mahi (on saffron risotto-yum!).
positive	AMBIENCE#GENERAL	Atmosphere	0:10	Atmosphere is nice and relaxed too...
positive	RESTAURANT#GENERAL	place	20:25	I really liked this place.
negative	RESTAURANT#GENERAL	Roth's	15:21	I have been to Roth's twice and both times were very disappointing.
positive	RESTAURANT#GENERAL	restaurant	24:34	I recently went to this restaurant with some co-workers for lunch and had an amazing time.
positive	RESTAURANT#MISCELLANEOUS	spot	20:24	This is the perfect spot for meeting friends, having lunch, dinner, pre-theatre or after-theatre drinks!
positive	FOOD#QUALITY	Ingredients	0:11	Ingredients are organic which is a real plus for me.
positive	FOOD#QUALITY	indian cuisine	63:77	But after last night, Spice Grill is the only place I'm eating indian cuisine.
positive	FOOD#QUALITY	omlette for brunch	4:22	The omlette for brunch is great...
positive	FOOD#QUALITY	meal	46:50	I have to say I have never had a disapointing meal here.
positive	FOOD#QUALITY	pastries	69:77	I got an excellent piece of cheesecake and we had several other nice pastries.
positive	SERVICE#GENERAL	service	35:42	The food was well prepared and the service impecable.
positive	AMBIENCE#GENERAL	atmosphere	4:14	The atmosphere was great.
positive	FOOD#PRICES	Chinese food	25:37	Simply some good tasting Chinese food at incredible prices...
positive	FOOD#QUALITY	homemade pasta	25:39	Pizza is terrific, as is homemade pasta.
positive	DRINKS#QUALITY	sassy lassi	15:26	My fav was the sassy lassi...
positive	FOOD#QUALITY	dishes	72:78	The food is delicious - from the specials to the regular menu-fare, the dishes are never a disappointment.
positive	FOOD#STYLE_OPTIONS	portions	42:50	Just because it's cheap does NOT mean the portions are small or the food is nasty, IT IS GREAT!
negative	RESTAURANT#MISCELLANEOUS	sushi chef	70:80	If you don't mind pre-sliced low quality fish, unfriendly staff and a sushi chef that looks like he is miserable then this is your place.
negative	FOOD#QUALITY	food	48:52	I can't remember the last time I had such gross food in New York.
positive	RESTAURANT#MISCELLANEOUS	place	86:91	If you are the type of person who likes being scared and entertained, this is a great place to go and eat.
negative	FOOD#QUALITY	food	4:8	The food however, is what one might expect.
positive	DRINKS#PRICES	selecion of wines	39:56	The food is great and they have a good selecion of wines at reasonable prices.
positive	RESTAURANT#MISCELLANEOUS	owner	4:9	The owner and staff are all Japanese as well and that adds to the entire ambiance.
